{
  "title": "The eagle-eye skill",
  "dims": [
    {
      "id": "driver",
      "problem": "A morphological box needs somebody to build it and somebody to read a change back. The agent could do both, or hand a page to a person and never see it again. This row decides whether a box is a one-way artifact the agent produces, or a document a person edits and returns for the agent to re-argue.",
      "name": "Who drives it",
      "opts": [
        {
          "id": "driver-method",
          "label": "Claude’s reasoning method: it builds the box in chat; the page is optional",
          "src": "chat Q1",
          "short": "Claude reasons in chat"
        },
        {
          "id": "driver-gen",
          "label": "A generator: Claude emits the page, you do the thinking",
          "src": "chat Q1",
          "short": "Generator only"
        },
        {
          "id": "driver-both",
          "label": "Both, round-tripped: Claude builds, you override and export, Claude re-argues",
          "chosen": true,
          "src": "chat Q1",
          "short": "Round-tripped"
        },
        {
          "id": "driver-none",
          "label": "No tool — keep grilling one question at a time",
          "strawman": true,
          "short": "No tool"
        }
      ]
    },
    {
      "id": "trigger",
      "problem": "A skill only helps if it starts at the right moment. Too eager and it builds a grid for two unrelated choices. Too shy and a tangled discussion never gets one. This row decides what wakes the skill: an explicit request, a coupling the agent notices, a host flow that calls it, or all three.",
      "name": "When it fires",
      "opts": [
        {
          "id": "trig-name",
          "label": "By name only: /eagle-eye",
          "src": "chat Q2",
          "short": "By name only"
        },
        {
          "id": "trig-signal",
          "label": "On the coupling smell alone: 3+ decisions where one pick changes another",
          "src": "chat Q2",
          "short": "Coupling smell"
        },
        {
          "id": "trig-hosts",
          "label": "As a stage inside brainstorming, grilling, wayfinder",
          "src": "chat Q2",
          "short": "Inside host flows"
        },
        {
          "id": "trig-full",
          "label": "Signal + host stages, with the name as fallback",
          "chosen": true,
          "src": "chat Q2",
          "short": "Smell + hosts + name"
        }
      ]
    },
    {
      "id": "edges",
      "problem": "An edge colours the grid, so a reader treats it as a fact. Some edges come from a measurement, some from a named document, and some from the author's own reasoning. This row decides whether the page shows that difference, and how much a weak edge must admit before it may colour anything.",
      "name": "Edge honesty",
      "opts": [
        {
          "id": "edge-evidence",
          "label": "Evidence required: no edge without a citation",
          "src": "chat Q3",
          "short": "Evidence required"
        },
        {
          "id": "edge-reason",
          "label": "Reasoning is enough: a one-line why",
          "src": "chat Q3",
          "short": "One-line why"
        },
        {
          "id": "edge-tiered",
          "label": "Tiered and labelled: measured / sourced / argued",
          "chosen": true,
          "src": "chat Q3",
          "short": "Tiered + labelled"
        },
        {
          "id": "edge-bare",
          "label": "Just the edge, no why at all",
          "strawman": true,
          "short": "No why"
        }
      ]
    },
    {
      "id": "moves",
      "problem": "After a reader changes an option, the page can report a verdict and stop, or it can point at what the reader has not looked at. A verdict alone closes the question. This row decides whether the panel also names the untouched row, the weakest edge, and the strawman that nothing ruled out.",
      "name": "What the panel says",
      "opts": [
        {
          "id": "moves-verdict",
          "label": "The verdict only: consistent / incomplete / does not hold",
          "strawman": true,
          "short": "Verdict only"
        },
        {
          "id": "moves-six",
          "label": "The six moves: untouched row, weakest edge, load-bearing option, free row, survived strawman, cogency test",
          "chosen": true,
          "src": "chat Q4",
          "short": "The six moves"
        }
      ]
    },
    {
      "id": "coach",
      "problem": "People remember a system better when they predict its behaviour before they see it. A page can force that, offer it, or skip it. Forcing it makes a quick lookup slow. This row decides whether prediction exists at all, and whether the reader opts in.",
      "name": "Coach layer",
      "opts": [
        {
          "id": "coach-none",
          "label": "None",
          "src": "chat Q5",
          "short": "None"
        },
        {
          "id": "coach-optin",
          "label": "Opt-in: predict before reveal",
          "chosen": true,
          "src": "chat Q5",
          "short": "Opt-in predict"
        },
        {
          "id": "coach-always",
          "label": "Always on: every override is a quiz",
          "strawman": true,
          "short": "Always a quiz"
        }
      ]
    },
    {
      "id": "audit",
      "problem": "Every edge is a reason, and a reason can be wrong in eight known ways. Checking all of them is thorough and slow. Checking none ships colour the reader cannot trust. This row decides which edges are audited before the box is rendered.",
      "name": "Edge audit",
      "opts": [
        {
          "id": "audit-none",
          "label": "None",
          "src": "chat Q5",
          "short": "None"
        },
        {
          "id": "audit-argued",
          "label": "The eight weakness patterns, on argued edges",
          "chosen": true,
          "src": "chat Q5",
          "short": "Argued edges"
        },
        {
          "id": "audit-all",
          "label": "On every edge, every tier",
          "src": "chat Q5",
          "short": "Every edge"
        }
      ]
    },
    {
      "id": "home",
      "problem": "A skill file sits either in the user's own directory or inside one repository. In the user's directory it works everywhere and travels with the person. In a repository it ships to a team and is reviewed like code. This row picks where the skill is installed.",
      "name": "Where it lives",
      "opts": [
        {
          "id": "home-user",
          "label": "User-level: ~/.claude/skills",
          "chosen": true,
          "src": "chat Q6",
          "short": "User-level"
        },
        {
          "id": "home-repo",
          "label": "This repo: .claude/skills, beside phase-gate",
          "src": "chat Q6",
          "short": "This repo"
        },
        {
          "id": "home-both",
          "label": "Developed here, promoted later",
          "src": "chat Q6",
          "short": "Here, then promote"
        }
      ]
    },
    {
      "id": "persist",
      "problem": "A box can vanish when the conversation ends, or be written to a file somebody commits. A file lets a later session re-argue the same decisions and lets a reader return to them. It also becomes one more document to keep true. This row decides whether a box outlives its conversation.",
      "name": "Does a box persist",
      "opts": [
        {
          "id": "persist-no",
          "label": "Ephemeral: conversation and page only",
          "src": "chat Q7",
          "short": "Ephemeral"
        },
        {
          "id": "persist-decision",
          "label": "Durable, one file per coupled decision",
          "chosen": true,
          "src": "chat Q7",
          "short": "File per decision"
        },
        {
          "id": "persist-project",
          "label": "Durable, one box per project",
          "src": "chat Q7",
          "short": "One per project"
        }
      ]
    },
    {
      "id": "build",
      "problem": "The page could be written by the model each time, produced by a fixed renderer from a data file, or served by a full command-line tool. A page re-authored each time drifts the export format that the round trip depends on. This row decides how much machinery the skill carries.",
      "name": "How it is built",
      "opts": [
        {
          "id": "build-prompt",
          "label": "Prompt-only: Claude hand-writes the page from a template",
          "src": "chat approaches",
          "short": "Prompt-only"
        },
        {
          "id": "build-renderer",
          "label": "Skill + zero-dep renderer: box file in, page out",
          "chosen": true,
          "src": "chat approaches",
          "short": "Skill + renderer"
        },
        {
          "id": "build-tool",
          "label": "A proper CLI / MCP tool: validate, render, diff",
          "src": "chat approaches",
          "short": "Full CLI / MCP"
        }
      ]
    },
    {
      "id": "page",
      "problem": "The rendered box has to reach the reader somehow: a local file they open, a hosted page with a link, or nothing beyond the chat. Hosting needs a tool that is not always available. This row decides the delivery, and what happens when the preferred one is missing.",
      "name": "Where the page goes",
      "opts": [
        {
          "id": "page-local",
          "label": "A local HTML file, opened in the browser; Artifact when available",
          "chosen": true,
          "src": "chat, my call",
          "short": "Local HTML"
        },
        {
          "id": "page-artifact",
          "label": "Artifact only",
          "src": "chat, my call",
          "short": "Artifact only"
        },
        {
          "id": "page-chat",
          "label": "No page: the markdown table is the whole tool",
          "strawman": true,
          "short": "No page"
        }
      ]
    },
    {
      "id": "data",